pair_key,source_id,target_id,source_label,target_label,source_display_label,target_display_label,source_display_concept_id,target_display_concept_id,source_display_refined,target_display_refined,display_refinement_confidence,source_alternate_display_labels,target_alternate_display_labels,source_bucket,target_bucket,cross_field,score,base_score,duplicate_penalty,path_support_norm,gap_bonus,mediator_count,motif_count,cooc_count,direct_link_status,supporting_path_count,why_now,recommended_move,slice_label,public_pair_label,question_family,suppress_from_public_ranked_window,top_mediator_labels,top_mediator_display_labels,top_mediator_baseline_labels,representative_papers,top_countries_source,top_countries_target,source_context_summary,target_context_summary,common_contexts,public_specificity_score,app_link
FG3C000159__FG3C004372,FG3C000159,FG3C004372,monetary policy shocks,investment in fixed assets,monetary policy shocks,investment in fixed assets,FG3C000159,FG3C004372,False,False,0.0,"['Expansionary monetary policy shock', 'Contractionary monetary policy shocks', 'real effects of monetary policy']","['fixed assets', 'assets in place', 'fixed-asset investment']",core,core,False,0.113959,0.202273,0.088314,0.000367,1.0,4,4,0,No direct papers yet,4,monetary policy shocks and investment in fixed assets are already linked by 4 nearby intermediate topics.,A short synthesis or pilot design looks like the sensible first move.,Missing direct link,investment in fixed assets and monetary policy shocks,monetary-policy-shocks-investment-in-fixed-assets,False,"['interest rates', 'price of risk', 'financial market uncertainty']","['interest rates', 'price of risk', 'financial market uncertainty']","['interest rates', 'price of risk', 'financial market uncertainty']","[{'paper_id': 'W4214559516__gpt5mini_low', 'title': 'Identifying monetary policy shocks using economic forecasts in Korea', 'year': 2022, 'edge_src': 'FG3C000159', 'edge_dst': 'FG3C000027', 'edge_src_display_label': 'monetary policy shocks', 'edge_dst_display_label': 'interest rates'}, {'paper_id': 'W4289779123__gpt5mini_low', 'title': 'Euro area banking and monetary policy shocks in the QE era', 'year': 2022, 'edge_src': 'FG3C000159', 'edge_dst': 'FG3C003370', 'edge_src_display_label': 'monetary policy shocks', 'edge_dst_display_label': 'price of risk'}, {'paper_id': 'W4367557963__gpt5mini_low', 'title': 'Uncertainties under monetary tightening and easing shocks and different market states', 'year': 2023, 'edge_src': 'FG3C000159', 'edge_dst': 'FG3C004137', 'edge_src_display_label': 'monetary policy shocks', 'edge_dst_display_label': 'financial market uncertainty'}]","['United States', 'euro area']","['China', '11 OECD countries']",United States and euro area,China and 11 OECD countries,monetary policy shocks studies are common in United States and euro area; investment in fixed assets studies are common in China and 11 OECD countries.,-0.9982,https://frontiergraph-app-1058669339361.us-central1.run.app?view=question&pair=FG3C000159__FG3C004372
FG3C000942__FG3C006124,FG3C000942,FG3C006124,Russia-Ukraine conflict,US dollar exchange rate,Russia-Ukraine conflict,US dollar exchange rate,FG3C000942,FG3C006124,False,False,0.0,['Russian-Ukrainian conflict'],"['dollar appreciation', 'dollar index', 'dollar']",adjacent,core,True,0.109629,0.202314,0.092685,0.000364,1.0,4,4,0,No direct papers yet,4,Russia-Ukraine conflict and US dollar exchange rate are already linked by 4 nearby intermediate topics.,Start with a short review or pilot study that follows the nearest mediating topics.,Missing direct link,US dollar exchange rate and Russia-Ukraine conflict,russia-ukraine-conflict-us-dollar-exchange-rate,False,"['oil prices', 'oil price', 'Bitcoin']","['oil prices', 'oil price', 'Bitcoin']","['oil prices', 'oil price', 'Bitcoin']","[{'paper_id': 'W2321560580__gpt5mini_low', 'title': 'Asymmetrical long-run dependence between oil price and US dollar exchange rate—Based on structural oil shocks', 'year': 2016, 'edge_src': 'FG3C000117', 'edge_dst': 'FG3C006124', 'edge_src_display_label': 'oil price', 'edge_dst_display_label': 'US dollar exchange rate'}, {'paper_id': 'W2727084617__gpt5mini_low', 'title': 'Cointegration test of oil price and us dollar exchange rates for some oil dependent economies', 'year': 2017, 'edge_src': 'FG3C000117', 'edge_dst': 'FG3C006124', 'edge_src_display_label': 'oil price', 'edge_dst_display_label': 'US dollar exchange rate'}, {'paper_id': 'W2026327710__gpt5mini_low', 'title': 'Oil and US dollar exchange rate dependence: A detrended cross-correlation approach', 'year': 2013, 'edge_src': 'FG3C000034', 'edge_dst': 'FG3C006124', 'edge_src_display_label': 'oil prices', 'edge_dst_display_label': 'US dollar exchange rate'}]","['Russia', 'Ukraine', 'RUS']","['United States', 'India']","Russia, Ukraine, and related settings",United States and India,"Russia-Ukraine conflict studies are common in Russia, Ukraine, and related settings; US dollar exchange rate studies are common in United States and India.",-0.9982,https://frontiergraph-app-1058669339361.us-central1.run.app?view=question&pair=FG3C000942__FG3C006124
FG3C000005__FG3C002261,FG3C000005,FG3C002261,COVID-19 pandemic,perceived behavioral control,COVID-19 pandemic,perceived behavioral control,FG3C000005,FG3C002261,False,False,0.0,"['coronavirus pandemic', 'pandemics', 'COVID-19 pandemic onset']","['behavioral intention', 'locus of control']",adjacent,adjacent,False,0.120161,0.202034,0.081874,0.000346,1.0,4,4,0,No direct papers yet,4,COVID-19 pandemic and perceived behavioral control are already linked by 4 nearby intermediate topics.,A short synthesis or pilot design looks like the sensible first move.,Missing direct link,COVID-19 pandemic and perceived behavioral control,covid-19-pandemic-perceived-behavioral-control,False,"['household assets', 'social interactions', 'passenger satisfaction']","['household assets', 'social interactions', 'passenger satisfaction']","['household assets', 'social interactions', 'passenger satisfaction']","[{'paper_id': 'W4379742478__gpt5mini_low', 'title': 'The impact of the COVID-19 pandemic on airlines’ passenger satisfaction', 'year': 2023, 'edge_src': 'FG3C000005', 'edge_dst': 'FG3C004630', 'edge_src_display_label': 'COVID-19 pandemic', 'edge_dst_display_label': 'passenger satisfaction'}, {'paper_id': 'W4285403984__gpt5mini_low', 'title': 'Has the COVID-19 pandemic affected public trust? Evidence for the US and the Netherlands', 'year': 2022, 'edge_src': 'FG3C000005', 'edge_dst': 'FG3C000666', 'edge_src_display_label': 'COVID-19 pandemic', 'edge_dst_display_label': 'trust'}, {'paper_id': 'W4313413104__gpt5mini_low', 'title': 'The Impacts of COVID-19 on Returned Migrants’ Livelihood Vulnerability in the Central Coastal Region of Vietnam', 'year': 2022, 'edge_src': 'FG3C000005', 'edge_dst': 'FG3C003273', 'edge_src_display_label': 'COVID-19 pandemic', 'edge_dst_display_label': 'social interactions'}]","['China', 'United States']","['China', 'Thailand']",China and United States,China and Thailand,COVID-19 pandemic studies are common in China and United States; perceived behavioral control studies are common in China and Thailand.,-0.9983,https://frontiergraph-app-1058669339361.us-central1.run.app?view=question&pair=FG3C000005__FG3C002261
FG3C000190__FG3C004234,FG3C004234,FG3C000190,Black-Scholes formula,bid-ask spread,Black-Scholes formula,bid-ask spread,FG3C004234,FG3C000190,False,False,0.0,"['Black-Scholes option pricing formula', 'Black–Scholes price', 'Black–Scholes equation']","['relative bid-ask spreads', 'market liquidity (bid-ask spread)', 'bid-ask bounce']",core,core,False,0.113786,0.202239,0.088452,0.000313,1.0,4,4,0,No direct papers yet,4,Black-Scholes formula and bid-ask spread are already linked by 4 nearby intermediate topics.,A short synthesis or pilot design looks like the sensible first move.,Missing direct link,bid-ask spread and Black-Scholes formula,black-scholes-formula-bid-ask-spread,False,"['volatility', 'option prices', 'stock prices']","['volatility', 'option prices', 'stock prices']","['volatility', 'option prices', 'stock prices']","[{'paper_id': 'W3215005462__gpt5mini_low', 'title': 'An Empirical Analysis of the Bid-ask Spread in the Continuous Intraday Trading of the German Power Market', 'year': 2021, 'edge_src': 'FG3C000043', 'edge_dst': 'FG3C000190', 'edge_src_display_label': 'volatility', 'edge_dst_display_label': 'bid-ask spread'}, {'paper_id': 'W3091107090__gpt5mini_low', 'title': 'Day-of-the-week effect and spread determinants: Some international evidence from equity markets', 'year': 2020, 'edge_src': 'FG3C000043', 'edge_dst': 'FG3C000190', 'edge_src_display_label': 'volatility', 'edge_dst_display_label': 'bid-ask spread'}, {'paper_id': 'W3122816220__gpt5mini_low', 'title': 'Implementing Option Pricing Models When Asset Returns Are Predictable', 'year': 1995, 'edge_src': 'FG3C004234', 'edge_dst': 'FG3C000692', 'edge_src_display_label': 'Black-Scholes formula', 'edge_dst_display_label': 'option prices'}]","['POL', 'ROU', 'HUN']","['United States', 'China']","POL, ROU, and related settings",United States and China,"Black-Scholes formula studies are common in POL, ROU, and related settings; bid-ask spread studies are common in United States and China.",-0.9984,https://frontiergraph-app-1058669339361.us-central1.run.app?view=question&pair=FG3C000190__FG3C004234
FG3C002284__FG3C006307,FG3C006307,FG3C002284,spatial autoregressive model,firm total factor productivity (TFP),spatial autoregressive model,firm total factor productivity (TFP),FG3C006307,FG3C002284,False,False,0.0,"['spatial weights matrix', 'spatial autocorrelation model', 'vector autoregressive model']","['firm total factor productivity', 'aggregate TFP', 'total factor productivity (TFP) of manufacturing firms']",core,core,False,0.178794,0.202126,0.023332,0.000291,1.0,4,4,0,No direct papers yet,4,spatial autoregressive model and firm total factor productivity (TFP) are already linked by 4 nearby intermediate topics.,A short synthesis or pilot design looks like the sensible first move.,Missing direct link,firm total factor productivity (TFP) and spatial autoregressive model,spatial-autoregressive-model-firm-total-factor-productivity,False,"['exports', 'foreign direct investment (FDI) flows', 'model selection']","['exports', 'foreign direct investment (FDI) flows', 'model selection']","['exports', 'foreign direct investment (FDI) flows', 'model selection']","[{'paper_id': 'W4412043326__gpt5mini_low', 'title': 'The Effects of Domestic and Foreign Green Technology on Domestic CO2 Emissions and Domestic Total Factor Productivity', 'year': 2025, 'edge_src': 'FG3C000126', 'edge_dst': 'FG3C002284', 'edge_src_display_label': 'imports', 'edge_dst_display_label': 'firm total factor productivity (TFP)'}, {'paper_id': 'W2032222690__gpt5mini_low', 'title': ""Re-estimation of firms' total factor productivity in China's iron and steel industry"", 'year': 2012, 'edge_src': 'FG3C000046', 'edge_dst': 'FG3C002284', 'edge_src_display_label': 'exports', 'edge_dst_display_label': 'firm total factor productivity (TFP)'}, {'paper_id': 'W2170141899__gpt5mini_low', 'title': 'Measuring Regional Spillovers in Long- and Short-Run Models of Total Factor Productivity, Trade, and FDI', 'year': 2012, 'edge_src': 'FG3C000046', 'edge_dst': 'FG3C002284', 'edge_src_display_label': 'exports', 'edge_dst_display_label': 'firm total factor productivity (TFP)'}]","['China', 'Italy', 'United States']","['China', 'United States']","China, Italy, and related settings",China and United States,"spatial autoregressive model studies are common in China, Italy, and related settings; firm total factor productivity (TFP) studies are common in China and United States.",-0.9985,https://frontiergraph-app-1058669339361.us-central1.run.app?view=question&pair=FG3C002284__FG3C006307
FG3C000085__FG3C000159,FG3C000159,FG3C000085,monetary policy shocks,gross domestic product (GDP),monetary policy shocks,gross domestic product (GDP),FG3C000159,FG3C000085,False,False,0.0,"['Expansionary monetary policy shock', 'Contractionary monetary policy shocks', 'real effects of monetary policy']","['gross national product (GNP)', 'GDP (gross domestic product)', 'gross state product (GSP)']",core,adjacent,True,0.117856,0.202778,0.084922,0.000305,1.0,4,4,0,No direct papers yet,4,monetary policy shocks and gross domestic product (GDP) are already linked by 4 nearby intermediate topics.,Start with a short review or pilot study that follows the nearest mediating topics.,Missing direct link,monetary policy shocks and gross domestic product (GDP),monetary-policy-shocks-gross-domestic-product,False,"['exchange rate', 'earnings inequality', 'S&P 500 volatility']","['exchange rate', 'earnings inequality', 'S&P 500 volatility']","['exchange rate', 'earnings inequality', 'U.S. stock market volatility']","[{'paper_id': 'W3123273648__gpt5mini_low', 'title': 'The impact of monetary policy on the exchange rate: evidence from three small open economies', 'year': 2004, 'edge_src': 'FG3C000159', 'edge_dst': 'FG3C000056', 'edge_src_display_label': 'monetary policy shocks', 'edge_dst_display_label': 'exchange rate'}, {'paper_id': 'W3134775058__gpt5mini_low', 'title': 'Evolving United States stock market volatility: The role of conventional and unconventional monetary policies', 'year': 2022, 'edge_src': 'FG3C000159', 'edge_dst': 'FG3C005517', 'edge_src_display_label': 'monetary policy shocks', 'edge_dst_display_label': 'S&P 500 volatility'}, {'paper_id': 'W4385781701__gpt5mini_low', 'title': 'Dynamic association of stock market volatility, foreign portfolio investment and macroeconomic indicators by taking the impact of structural breaks', 'year': 2023, 'edge_src': 'FG3C005517', 'edge_dst': 'FG3C000085', 'edge_src_display_label': 'S&P 500 volatility', 'edge_dst_display_label': 'gross domestic product (GDP)'}]","['United States', 'euro area']","['China', 'United States', 'India']",United States and euro area,"China, United States, and related settings","monetary policy shocks studies are common in United States and euro area; gross domestic product (GDP) studies are common in China, United States, and related settings.",-0.9985,https://frontiergraph-app-1058669339361.us-central1.run.app?view=question&pair=FG3C000085__FG3C000159
FG3C000061__FG3C002714,FG3C002714,FG3C000061,command-and-control regulation,total factor productivity (TFP),command-and-control regulation,total factor productivity (TFP),FG3C002714,FG3C000061,False,False,0.0,[],['productivity (TFP)'],adjacent,core,True,0.115389,0.202063,0.086675,0.000298,1.0,4,4,0,No direct papers yet,4,command-and-control regulation and total factor productivity (TFP) are already linked by 4 nearby intermediate topics.,Start with a short review or pilot study that follows the nearest mediating topics.,Missing direct link,total factor productivity (TFP) and command-and-control regulation,command-and-control-regulation-total-factor-productivity,False,"['technological innovation', 'technical progress', 'green innovation']","['technological innovation', 'technical progress', 'green innovation']","['technological innovation', 'technical progress', 'green innovation']","[{'paper_id': 'W4412017035__gpt5mini_low', 'title': 'Green Innovation, Export Synergy, and Total Factor Productivity: Evidence from China’s Marine Enterprises', 'year': 2025, 'edge_src': 'FG3C000053', 'edge_dst': 'FG3C000061', 'edge_src_display_label': 'green innovation', 'edge_dst_display_label': 'total factor productivity (TFP)'}, {'paper_id': 'W4291914113__gpt5mini_low', 'title': ""The internal-structural effects of different types of environmental regulations on China's green total-factor productivity"", 'year': 2022, 'edge_src': 'FG3C002714', 'edge_dst': 'FG3C000013', 'edge_src_display_label': 'command-and-control regulation', 'edge_dst_display_label': 'technological innovation'}, {'paper_id': 'W4400698326__gpt5mini_low', 'title': ""Mitigating excessive financialization or promoting innovation? Productivity effects of China's carbon emission trading scheme"", 'year': 2024, 'edge_src': 'FG3C003006', 'edge_dst': 'FG3C000061', 'edge_src_display_label': 'emissions trading system', 'edge_dst_display_label': 'total factor productivity (TFP)'}]","['China', 'United States', 'Colombia']","['China', 'Italy', 'United States']","China, United States, and related settings","China, Italy, and related settings","command-and-control regulation studies are common in China, United States, and related settings; total factor productivity (TFP) studies are common in China, Italy, and related settings.",-0.9985,https://frontiergraph-app-1058669339361.us-central1.run.app?view=question&pair=FG3C000061__FG3C002714
FG3C000215__FG3C005009,FG3C005009,FG3C000215,fixed effects model,green total factor productivity (GTFP),fixed effects model,green total factor productivity (GTFP),FG3C005009,FG3C000215,False,False,0.0,"['fixed effects', 'two-way fixed effects model', 'fixed effects estimator']","['agricultural green total factor productivity (AGTFP)', 'enterprise green total factor productivity (GTFP)', 'industrial green total factor productivity (GTFP)']",core,adjacent,True,0.112467,0.201844,0.089376,0.000297,1.0,4,4,0,No direct papers yet,4,fixed effects model and green total factor productivity (GTFP) are already linked by 4 nearby intermediate topics.,Start with a short review or pilot study that follows the nearest mediating topics.,Missing direct link,fixed effects model and green total factor productivity (GTFP),fixed-effects-model-green-total-factor-productivity,False,"['ICT development', 'digital economy', 'population aging']","['ICT development', 'digital economy', 'population aging']","['ICT development', 'digital economy', 'population aging']","[{'paper_id': 'W4294718866__gpt5mini_low', 'title': 'Path to sustainable development: Does digital economy matter in manufacturing green total factor productivity?', 'year': 2022, 'edge_src': 'FG3C000068', 'edge_dst': 'FG3C000215', 'edge_src_display_label': 'digital economy', 'edge_dst_display_label': 'green total factor productivity (GTFP)'}, {'paper_id': 'W4393201111__gpt5mini_low', 'title': 'Exploring the Impact of the Digital Economy on Green Total Factor Productivity—Evidence from Chinese Cities', 'year': 2024, 'edge_src': 'FG3C000068', 'edge_dst': 'FG3C000215', 'edge_src_display_label': 'digital economy', 'edge_dst_display_label': 'green total factor productivity (GTFP)'}, {'paper_id': 'W4366091474__gpt5mini_low', 'title': 'Exploring the Direct and Spillover Effects of Aging on Green Total Factor Productivity in China: A Spatial Econometric Approach', 'year': 2023, 'edge_src': 'FG3C000376', 'edge_dst': 'FG3C000215', 'edge_src_display_label': 'population aging', 'edge_dst_display_label': 'green total factor productivity (GTFP)'}]","['China', '55 countries', 'United States']","['China', 'OECD']","China, 55 countries, and related settings",China and OECD,"fixed effects model studies are common in China, 55 countries, and related settings; green total factor productivity (GTFP) studies are common in China and OECD.",-0.9985,https://frontiergraph-app-1058669339361.us-central1.run.app?view=question&pair=FG3C000215__FG3C005009
FG3C001863__FG3C003775,FG3C003775,FG3C001863,price of gold,China stock market,price of gold,China stock market,FG3C003775,FG3C001863,False,False,0.0,"['safe-haven property', 'level of reserves', 'platinum price']","['Chinese financial markets', 'Chinese market', 'Chinese A-share market']",core,core,False,0.180238,0.201836,0.021598,0.000272,1.0,4,4,0,No direct papers yet,4,price of gold and China stock market are already linked by 4 nearby intermediate topics.,A short synthesis or pilot design looks like the sensible first move.,Missing direct link,China stock market and price of gold,price-of-gold-china-stock-market,False,"['WTI crude oil futures', 'gold', 'gold prices']","['WTI crude oil futures', 'gold', 'gold prices']","['WTI crude oil futures', 'gold', 'gold prices']","[{'paper_id': 'W2029723097__gpt5mini_low', 'title': 'The effect of the price of gold on its production: a time-series analysis', 'year': 1999, 'edge_src': 'FG3C003775', 'edge_dst': 'FG3C000101', 'edge_src_display_label': 'price of gold', 'edge_dst_display_label': 'gold'}, {'paper_id': 'W3192047975__gpt5mini_low', 'title': 'Do currency exchange rates impact gold prices? New evidence from the ongoing COVID-19 period', 'year': 2021, 'edge_src': 'FG3C003775', 'edge_dst': 'FG3C000469', 'edge_src_display_label': 'price of gold', 'edge_dst_display_label': 'gold prices'}, {'paper_id': 'W4220833694__gpt5mini_low', 'title': 'Dynamic spillover effects and portfolio strategies between crude oil, gold and Chinese stock markets related to new energy vehicle', 'year': 2022, 'edge_src': 'FG3C000101', 'edge_dst': 'FG3C001863', 'edge_src_display_label': 'gold', 'edge_dst_display_label': 'China stock market'}]","['United States', 'India', 'Europe']","['China', 'Canada']","United States, India, and related settings",China and Canada,"price of gold studies are common in United States, India, and related settings; China stock market studies are common in China and Canada.",-0.9986,https://frontiergraph-app-1058669339361.us-central1.run.app?view=question&pair=FG3C001863__FG3C003775
FG3C000599__FG3C006124,FG3C000599,FG3C006124,US stock market,US dollar exchange rate,US stock market,US dollar exchange rate,FG3C000599,FG3C006124,False,False,0.0,"['stock market data', 'New York Stock Exchange (NYSE)', 'stock index']","['dollar appreciation', 'dollar index', 'dollar']",core,core,False,0.175679,0.20183,0.026152,0.000271,1.0,4,4,0,No direct papers yet,4,US stock market and US dollar exchange rate are already linked by 4 nearby intermediate topics.,A short synthesis or pilot design looks like the sensible first move.,Missing direct link,US dollar exchange rate and US stock market,us-stock-market-us-dollar-exchange-rate,False,"['exchange rates', 'oil', 'gold']","['exchange rates', 'oil', 'gold']","['exchange rates', 'oil', 'gold']","[{'paper_id': 'W3005434226__gpt5mini_low', 'title': 'Characteristics of spillovers between the US stock market and precious metals and oil', 'year': 2020, 'edge_src': 'FG3C000599', 'edge_dst': 'FG3C000438', 'edge_src_display_label': 'US stock market', 'edge_dst_display_label': 'oil'}, {'paper_id': 'W3179226722__gpt5mini_low', 'title': 'Interdependence between exchange rates: Evidence from multivariate analysis since the financial crisis to the COVID-19 crisis', 'year': 2021, 'edge_src': 'FG3C000072', 'edge_dst': 'FG3C006124', 'edge_src_display_label': 'exchange rates', 'edge_dst_display_label': 'US dollar exchange rate'}, {'paper_id': 'W2916989671__gpt5mini_low', 'title': 'RETRACTED: On the conditional dependence structure between oil, gold and USD exchange rates: Nested copula based GJR-GARCH model', 'year': 2019, 'edge_src': 'FG3C000101', 'edge_dst': 'FG3C006124', 'edge_src_display_label': 'gold', 'edge_dst_display_label': 'US dollar exchange rate'}]","['United States', 'China']","['United States', 'India']",United States and China,United States and India,US stock market studies are common in United States and China; US dollar exchange rate studies are common in United States and India.,-0.9986,https://frontiergraph-app-1058669339361.us-central1.run.app?view=question&pair=FG3C000599__FG3C006124
FG3C001534__FG3C002284,FG3C001534,FG3C002284,unconventional monetary policy,firm total factor productivity (TFP),unconventional monetary policy,firm total factor productivity (TFP),FG3C001534,FG3C002284,False,False,0.0,"['unconventional monetary policy measures', 'unconventional monetary policies']","['firm total factor productivity', 'aggregate TFP', 'total factor productivity (TFP) of manufacturing firms']",core,core,False,0.119413,0.201957,0.082545,0.000281,1.0,4,4,0,No direct papers yet,4,unconventional monetary policy and firm total factor productivity (TFP) are already linked by 4 nearby intermediate topics.,A short synthesis or pilot design looks like the sensible first move.,Missing direct link,firm total factor productivity (TFP) and unconventional monetary policy,unconventional-monetary-policy-firm-total-factor-productivity,False,"['exports', 'firm risk', 'imports']","['exports', 'firm risk', 'imports']","['exports', 'firm risk', 'imports']","[{'paper_id': 'W3124433731__gpt5mini_low', 'title': 'Currency Wars? Unconventional Monetary Policy Does Not Stimulate Exports', 'year': 2021, 'edge_src': 'FG3C001534', 'edge_dst': 'FG3C000046', 'edge_src_display_label': 'unconventional monetary policy', 'edge_dst_display_label': 'exports'}, {'paper_id': 'W3043958599__gpt5mini_low', 'title': 'Unconventional monetary policy and bank risk taking', 'year': 2020, 'edge_src': 'FG3C001534', 'edge_dst': 'FG3C001842', 'edge_src_display_label': 'unconventional monetary policy', 'edge_dst_display_label': 'firm risk'}, {'paper_id': 'W2032222690__gpt5mini_low', 'title': ""Re-estimation of firms' total factor productivity in China's iron and steel industry"", 'year': 2012, 'edge_src': 'FG3C000046', 'edge_dst': 'FG3C002284', 'edge_src_display_label': 'exports', 'edge_dst_display_label': 'firm total factor productivity (TFP)'}]","['United States', 'Japan']","['China', 'United States']",United States and Japan,China and United States,unconventional monetary policy studies are common in United States and Japan; firm total factor productivity (TFP) studies are common in China and United States.,-0.9986,https://frontiergraph-app-1058669339361.us-central1.run.app?view=question&pair=FG3C001534__FG3C002284
