pair_key,source_id,target_id,source_label,target_label,source_display_label,target_display_label,source_display_concept_id,target_display_concept_id,source_display_refined,target_display_refined,display_refinement_confidence,source_alternate_display_labels,target_alternate_display_labels,source_bucket,target_bucket,cross_field,score,base_score,duplicate_penalty,path_support_norm,gap_bonus,mediator_count,motif_count,cooc_count,direct_link_status,supporting_path_count,why_now,recommended_move,slice_label,public_pair_label,question_family,suppress_from_public_ranked_window,top_mediator_labels,top_mediator_display_labels,top_mediator_baseline_labels,representative_papers,top_countries_source,top_countries_target,source_context_summary,target_context_summary,common_contexts,public_specificity_score,app_link
FG3C004134__FG3C005136,FG3C005136,FG3C004134,logistic regression model,willingness to accept (WTA),logistic regression,willingness to accept (WTA),FG3C009917,FG3C004134,True,False,0.2545,"['multinomial logistic regression', 'logit models', 'logistic regression models']",['willingness to accept (WTA) compensation'],adjacent,adjacent,False,0.116929,0.201812,0.084884,0.000422,1.0,1,1,0,No direct papers yet,1,logistic regression and willingness to accept (WTA) are already linked by 1 nearby intermediate topics.,A short synthesis or pilot design looks like the sensible first move.,Missing direct link,logistic regression and willingness to accept (WTA),logistic-regression-willingness-to-accept,False,['willingness to pay (WTP)'],['willingness to pay (WTP)'],['willingness to pay (WTP)'],"[{'paper_id': 'W2077746032__gpt5mini_low', 'title': ""The economic value of informal care: a study of informal caregivers' and patients' willingness to pay and willingness to accept for informal care"", 'year': 2005, 'edge_src': 'FG3C000323', 'edge_dst': 'FG3C004134', 'edge_src_display_label': 'willingness to pay (WTP)', 'edge_dst_display_label': 'willingness to accept (WTA)'}, {'paper_id': 'W4394000026__gpt5mini_low', 'title': 'Determinants of Visitors’ Willingness to Pay for Enhanced Ecosystem Services in Mudumalai Tiger Reserve, Tamil Nadu, India: A Contingent Valuation Approach', 'year': 2024, 'edge_src': 'FG3C005136', 'edge_dst': 'FG3C000323', 'edge_src_display_label': 'logistic regression', 'edge_dst_display_label': 'willingness to pay (WTP)'}, {'paper_id': 'W1585341416__gpt5mini_low', 'title': 'Using a Generalized Linear Mixed Model to Analyze Dichotomous Choice Contingent Valuation Data', 'year': 1994, 'edge_src': 'FG3C005136', 'edge_dst': 'FG3C000323', 'edge_src_display_label': 'logistic regression', 'edge_dst_display_label': 'willingness to pay (WTP)'}]","['China', 'United States', 'OECD']","['China', 'Spain']","China, United States, and related settings",China and Spain,"logistic regression studies are common in China, United States, and related settings; willingness to accept (WTA) studies are common in China and Spain.",2.2021,https://frontiergraph-app-1058669339361.us-central1.run.app?view=question&pair=FG3C004134__FG3C005136
FG3C000013__FG3C002623,FG3C000013,FG3C002623,technological innovation,US economic policy uncertainty,technological innovation,U.S. economic policy uncertainty,FG3C000013,FG3C014179,False,True,0.3655,"['agricultural technological innovation', 'technological investment', 'corporate technological innovation']","['US economic policy uncertainty (US EPU)', 'US policy uncertainty', 'US GDP growth']",adjacent,core,True,0.114586,0.203272,0.088686,0.000301,1.0,1,2,0,No direct papers yet,1,technological innovation and U.S. economic policy uncertainty are already linked by 1 nearby intermediate topics.,Start with a short review or pilot study that follows the nearest mediating topics.,Missing direct link,U.S. economic policy uncertainty and technological innovation,technological-innovation-u-s-economic-policy-uncertainty,False,['carbon dioxide (CO2) emission'],['carbon dioxide (CO2) emission'],['carbon dioxide (CO2) emissions'],"[{'paper_id': 'W3088117561__gpt5mini_low', 'title': 'Energy consumption, economic policy uncertainty and carbon emissions; causality evidence from resource rich economies', 'year': 2020, 'edge_src': 'FG3C000167', 'edge_dst': 'FG3C002623', 'edge_src_display_label': 'carbon dioxide (CO2) emission', 'edge_dst_display_label': 'U.S. economic policy uncertainty'}, {'paper_id': 'W4408561684__gpt5mini_low', 'title': 'Revisiting the determinants of CO2 emissions: The role of higher education under the extended STIRPAT model', 'year': 2025, 'edge_src': 'FG3C000013', 'edge_dst': 'FG3C000167', 'edge_src_display_label': 'technological innovation', 'edge_dst_display_label': 'carbon dioxide (CO2) emission'}, {'paper_id': 'W4401173522__gpt5mini_low', 'title': 'Impacts of Fintech and natural resources on environmental quality: The role of renewable energy and carbon taxes: A panel <scp>QARDL</scp> approach', 'year': 2024, 'edge_src': 'FG3C000013', 'edge_dst': 'FG3C000167', 'edge_src_display_label': 'technological innovation', 'edge_dst_display_label': 'carbon dioxide (CO2) emission'}]","['China', 'India']","['United States', 'China']",China and India,United States and China,technological innovation studies are common in China and India; U.S. economic policy uncertainty studies are common in United States and China.,2.2015,https://frontiergraph-app-1058669339361.us-central1.run.app?view=question&pair=FG3C000013__FG3C002623
FG3C000015__FG3C003298,FG3C000015,FG3C003298,foreign direct investments,subjective well-being,foreign direct investments,subjective well-being,FG3C000015,FG3C003298,False,False,0.0,"['foreign firm', 'FDI (Foreign Direct Investment)', 'export promotion policies']",['psychological well-being'],adjacent,adjacent,False,0.116362,0.203621,0.087259,0.001246,1.0,6,5,0,No direct papers yet,6,foreign direct investments and subjective well-being are already linked by 6 nearby intermediate topics.,A short synthesis or pilot design looks like the sensible first move.,Missing direct link,foreign direct investments and subjective well-being,foreign-direct-investments-subjective-well-being,False,"['renewable energy consumption', 'environmental quality', 'ecological footprints']","['renewable energy consumption', 'environmental quality', 'ecological footprints']","['renewable energy consumption', 'environmental quality (CO2 emissions)', 'ecological footprints']","[{'paper_id': 'W3121897450__gpt5mini_low', 'title': 'Partial Correlation Analysis of Association between Subjective Well-Being and Ecological Footprint', 'year': 2021, 'edge_src': 'FG3C001218', 'edge_dst': 'FG3C003298', 'edge_src_display_label': 'ecological footprints', 'edge_dst_display_label': 'subjective well-being'}, {'paper_id': 'W7118159808__gpt5mini_low', 'title': 'Natural Resource Rents and Capital Formation Nexus: Empirical Evidence on Foreign Direct Investment as a Moderator from the BRICS Economies', 'year': 2026, 'edge_src': 'FG3C000015', 'edge_dst': 'FG3C000249', 'edge_src_display_label': 'foreign direct investments', 'edge_dst_display_label': 'natural resource rents'}, {'paper_id': 'W4408296546__gpt5mini_low', 'title': 'The Effects of Foreign Direct Investment and Technological Innovation on Renewable Energy Consumption Under Varying Market Conditions in the EU', 'year': 2025, 'edge_src': 'FG3C000015', 'edge_dst': 'FG3C000018', 'edge_src_display_label': 'foreign direct investments', 'edge_dst_display_label': 'renewable energy consumption'}]","['China', 'India']","['China', 'Côte d’Ivoire', '101 countries']",China and India,"China, Côte d’Ivoire, and related settings","foreign direct investments studies are common in China and India; subjective well-being studies are common in China, Côte d’Ivoire, and related settings.",0.2062,https://frontiergraph-app-1058669339361.us-central1.run.app?view=question&pair=FG3C000015__FG3C003298
FG3C003130__FG3C006124,FG3C006124,FG3C003130,US dollar exchange rate,S&P 500 returns,US dollar exchange rate,S&P 500 returns,FG3C006124,FG3C003130,False,False,0.0,"['dollar appreciation', 'dollar index', 'dollar']","['S&P500 returns', 'WTI returns', 'S&P 500 index returns']",core,core,False,0.180355,0.203224,0.022869,0.000848,1.0,6,6,0,No direct papers yet,6,US dollar exchange rate and S&P 500 returns are already linked by 6 nearby intermediate topics.,A short synthesis or pilot design looks like the sensible first move.,Missing direct link,S&P 500 returns and US dollar exchange rate,us-dollar-exchange-rate-s-p-500-returns,False,"['crude oil prices', 'gold returns', 'U.S. stock returns']","['crude oil prices', 'gold returns', 'U.S. stock returns']","['crude oil prices', 'gold returns', 'U.S. stock returns']","[{'paper_id': 'W3199311310__gpt5mini_low', 'title': 'Nonlinear Causality between Crude Oil Prices and Exchange Rates: Evidence and Forecasting', 'year': 2021, 'edge_src': 'FG3C006124', 'edge_dst': 'FG3C000156', 'edge_src_display_label': 'US dollar exchange rate', 'edge_dst_display_label': 'crude oil prices'}, {'paper_id': 'W2099057455__gpt5mini_low', 'title': 'Modelling dynamic dependence between crude oil prices and Asia-Pacific stock market returns', 'year': 2013, 'edge_src': 'FG3C000156', 'edge_dst': 'FG3C003130', 'edge_src_display_label': 'crude oil prices', 'edge_dst_display_label': 'S&P 500 returns'}, {'paper_id': 'W2792833082__gpt5mini_low', 'title': 'Does social network sentiment influence the relationship between the S&amp;P 500 and gold returns?', 'year': 2018, 'edge_src': 'FG3C000960', 'edge_dst': 'FG3C003130', 'edge_src_display_label': 'gold returns', 'edge_dst_display_label': 'S&P 500 returns'}]","['United States', 'India']","['United States', 'South Africa']",United States and India,United States and South Africa,US dollar exchange rate studies are common in United States and India; S&P 500 returns studies are common in United States and South Africa.,0.2042,https://frontiergraph-app-1058669339361.us-central1.run.app?view=question&pair=FG3C003130__FG3C006124
FG3C000215__FG3C003680,FG3C003680,FG3C000215,spatial Durbin model (SDM),green total factor productivity (GTFP),spatial Durbin model (SDM),green total factor productivity (GTFP),FG3C003680,FG3C000215,False,False,0.0,['spatial Durbin model (spatial econometric model)'],"['agricultural green total factor productivity (AGTFP)', 'enterprise green total factor productivity (GTFP)', 'industrial green total factor productivity (GTFP)']",adjacent,adjacent,False,0.115372,0.204333,0.088961,0.000701,1.0,6,7,0,No direct papers yet,6,spatial Durbin model (SDM) and green total factor productivity (GTFP) are already linked by 6 nearby intermediate topics.,A short synthesis or pilot design looks like the sensible first move.,Missing direct link,green total factor productivity (GTFP) and spatial Durbin model (SDM),spatial-durbin-model-green-total-factor-productivity,False,"['technological progress', 'transportation infrastructure', 'green finance development']","['technological progress', 'transportation infrastructure', 'green finance development']","['technological progress', 'transportation infrastructure', 'green finance development']","[{'paper_id': 'W3116882850__gpt5mini_low', 'title': 'Empirical Study of the Spatial Spillover Effect of Transportation Infrastructure on Green Total Factor Productivity', 'year': 2020, 'edge_src': 'FG3C000877', 'edge_dst': 'FG3C000215', 'edge_src_display_label': 'transportation infrastructure', 'edge_dst_display_label': 'green total factor productivity (GTFP)'}, {'paper_id': 'W4300817316__gpt5mini_low', 'title': 'Transportation infrastructure, economic agglomeration and non-linearities of green total factor productivity growth in China: Evidence from partially linear functional coefficient model', 'year': 2022, 'edge_src': 'FG3C000877', 'edge_dst': 'FG3C000215', 'edge_src_display_label': 'transportation infrastructure', 'edge_dst_display_label': 'green total factor productivity (GTFP)'}, {'paper_id': 'W3215277893__gpt5mini_low', 'title': 'Research on the Impact of Environmental Regulations on Industrial Green Total Factor Productivity: Perspectives on the Changes in the Allocation Ratio of Factors among Different Industries', 'year': 2021, 'edge_src': 'FG3C000120', 'edge_dst': 'FG3C000215', 'edge_src_display_label': 'environmental regulations', 'edge_dst_display_label': 'green total factor productivity (GTFP)'}]","['China', 'Netherlands']","['China', 'OECD']",China and Netherlands,China and OECD,spatial Durbin model (SDM) studies are common in China and Netherlands; green total factor productivity (GTFP) studies are common in China and OECD.,0.2035,https://frontiergraph-app-1058669339361.us-central1.run.app?view=question&pair=FG3C000215__FG3C003680
FG3C000071__FG3C003298,FG3C000071,FG3C003298,economic policy uncertainty,subjective well-being,economic policy uncertainty,subjective well-being,FG3C000071,FG3C003298,False,False,0.0,"['economic policy uncertainty index', 'economic policy uncertainty (EPU)', 'US policy uncertainty']",['psychological well-being'],core,adjacent,True,0.109834,0.20236,0.092525,0.000672,1.0,6,5,0,No direct papers yet,6,economic policy uncertainty and subjective well-being are already linked by 6 nearby intermediate topics.,Start with a short review or pilot study that follows the nearest mediating topics.,Missing direct link,economic policy uncertainty and subjective well-being,economic-policy-uncertainty-subjective-well-being,False,"['renewable energy consumption', 'non-renewable energy consumption', 'natural resource rents']","['renewable energy consumption', 'non-renewable energy consumption', 'natural resource rents']","['renewable energy consumption', 'non-renewable energy consumption', 'natural resource rents']","[{'paper_id': 'W4307645419__gpt5mini_low', 'title': 'Influence of economic policy uncertainty and financial development on renewable energy consumption in the BRICST region', 'year': 2022, 'edge_src': 'FG3C000071', 'edge_dst': 'FG3C000018', 'edge_src_display_label': 'economic policy uncertainty', 'edge_dst_display_label': 'renewable energy consumption'}, {'paper_id': 'W3192049952__gpt5mini_low', 'title': 'Does economic policy uncertainty affect renewable energy consumption?', 'year': 2021, 'edge_src': 'FG3C000071', 'edge_dst': 'FG3C000018', 'edge_src_display_label': 'economic policy uncertainty', 'edge_dst_display_label': 'renewable energy consumption'}, {'paper_id': 'W3121897450__gpt5mini_low', 'title': 'Partial Correlation Analysis of Association between Subjective Well-Being and Ecological Footprint', 'year': 2021, 'edge_src': 'FG3C001218', 'edge_dst': 'FG3C003298', 'edge_src_display_label': 'ecological footprints', 'edge_dst_display_label': 'subjective well-being'}]","['China', 'United States']","['China', 'Côte d’Ivoire', '101 countries']",China and United States,"China, Côte d’Ivoire, and related settings","economic policy uncertainty studies are common in China and United States; subjective well-being studies are common in China, Côte d’Ivoire, and related settings.",0.2034,https://frontiergraph-app-1058669339361.us-central1.run.app?view=question&pair=FG3C000071__FG3C003298
FG3C000005__FG3C002924,FG3C000005,FG3C002924,COVID-19 pandemic,net interest margin,COVID-19 pandemic,net interest margin,FG3C000005,FG3C002924,False,False,0.0,"['coronavirus pandemic', 'pandemics', 'COVID-19 pandemic onset']","['net interest margins', 'bank interest margins']",adjacent,core,True,0.123742,0.20356,0.079818,0.000539,1.0,6,6,0,No direct papers yet,6,COVID-19 pandemic and net interest margin are already linked by 6 nearby intermediate topics.,Start with a short review or pilot study that follows the nearest mediating topics.,Missing direct link,net interest margin and COVID-19 pandemic,covid-19-pandemic-net-interest-margin,False,"['inflation', 'bank-specific characteristics', 'equity returns']","['inflation', 'bank-specific characteristics', 'equity returns']","['inflation', 'bank-specific characteristics', 'equity returns']","[{'paper_id': 'W4313889421__gpt5mini_low', 'title': 'COVID-19 pandemic and the stock market: Liquidity, price efficiency, and trading', 'year': 2023, 'edge_src': 'FG3C000005', 'edge_dst': 'FG3C000057', 'edge_src_display_label': 'COVID-19 pandemic', 'edge_dst_display_label': 'liquidity'}, {'paper_id': 'W2556106148__gpt5mini_low', 'title': 'Determinants of Net Interest Margin of Commercial Banks in Vietnam', 'year': 2015, 'edge_src': 'FG3C000082', 'edge_dst': 'FG3C002924', 'edge_src_display_label': 'risk aversion', 'edge_dst_display_label': 'net interest margin'}, {'paper_id': 'W2290948080__gpt5mini_low', 'title': 'The determinants of bank net interest margins: A panel evidence from South Asian countries', 'year': 2016, 'edge_src': 'FG3C000057', 'edge_dst': 'FG3C002924', 'edge_src_display_label': 'liquidity', 'edge_dst_display_label': 'net interest margin'}]","['China', 'United States']","['China', 'Pakistan', 'United States']",China and United States,"China, Pakistan, and related settings","COVID-19 pandemic studies are common in China and United States; net interest margin studies are common in China, Pakistan, and related settings.",0.2027,https://frontiergraph-app-1058669339361.us-central1.run.app?view=question&pair=FG3C000005__FG3C002924
FG3C000005__FG3C001518,FG3C000005,FG3C001518,COVID-19 pandemic,equity risk premium,COVID-19 pandemic,equity risk premium,FG3C000005,FG3C001518,False,False,0.0,"['coronavirus pandemic', 'pandemics', 'COVID-19 pandemic onset']",[],adjacent,core,True,0.110448,0.202051,0.091602,0.000241,1.0,6,5,0,No direct papers yet,6,COVID-19 pandemic and equity risk premium are already linked by 6 nearby intermediate topics.,Start with a short review or pilot study that follows the nearest mediating topics.,Missing direct link,equity risk premium and COVID-19 pandemic,covid-19-pandemic-equity-risk-premium,False,"['equity prices', 'financial contagion', 'risk aversion']","['equity prices', 'financial contagion', 'risk aversion']","['equity prices', 'financial contagion', 'risk aversion']","[{'paper_id': 'W3036868177__gpt5mini_low', 'title': 'Impact of the COVID-19 Pandemic on the Crude Oil and Stock Markets in the US: A Time-Varying Analysis', 'year': 2020, 'edge_src': 'FG3C000005', 'edge_dst': 'FG3C000035', 'edge_src_display_label': 'COVID-19 pandemic', 'edge_dst_display_label': 'stock returns'}, {'paper_id': 'W3123078795__gpt5mini_low', 'title': 'Financial contagion risk and the stochastic discount factor', 'year': 2017, 'edge_src': 'FG3C000757', 'edge_dst': 'FG3C001518', 'edge_src_display_label': 'financial contagion', 'edge_dst_display_label': 'equity risk premium'}, {'paper_id': 'W4226486871__gpt5mini_low', 'title': 'Higher order risk attitudes in the time of COVID-19: an experimental study', 'year': 2022, 'edge_src': 'FG3C000005', 'edge_dst': 'FG3C000082', 'edge_src_display_label': 'COVID-19 pandemic', 'edge_dst_display_label': 'risk aversion'}]","['China', 'United States']","['United States', 'Denmark', 'United Kingdom']",China and United States,"United States, Denmark, and related settings","COVID-19 pandemic studies are common in China and United States; equity risk premium studies are common in United States, Denmark, and related settings.",0.2012,https://frontiergraph-app-1058669339361.us-central1.run.app?view=question&pair=FG3C000005__FG3C001518
FG3C000015__FG3C001309,FG3C000015,FG3C001309,foreign direct investments,agricultural output,foreign direct investments,agricultural output,FG3C000015,FG3C001309,False,False,0.0,"['foreign firm', 'FDI (Foreign Direct Investment)', 'export promotion policies']","['output (aggregate output)', 'manufacturing output growth']",adjacent,adjacent,False,0.110149,0.210428,0.100279,0.006538,1.0,10,8,0,No direct papers yet,10,foreign direct investments and agricultural output are already linked by 10 nearby intermediate topics.,A short synthesis or pilot design looks like the sensible first move.,Missing direct link,agricultural output and foreign direct investments,foreign-direct-investments-agricultural-output,False,"['CO2 emissions', 'economic growth (GDP)', 'energy consumption']","['CO2 emissions', 'economic growth (GDP)', 'energy consumption']","['CO2 emissions', 'economic growth (GDP)', 'energy consumption']","[{'paper_id': 'W4392057236__gpt5mini_low', 'title': 'Does FDI affect energy consumption in the belt and road initiative economies? The role of green technologies', 'year': 2024, 'edge_src': 'FG3C000015', 'edge_dst': 'FG3C000014', 'edge_src_display_label': 'foreign direct investments', 'edge_dst_display_label': 'energy consumption'}, {'paper_id': 'W4304785813__gpt5mini_low', 'title': 'Impact of financial development on energy consumption in China: A spatial spillover analysis', 'year': 2022, 'edge_src': 'FG3C000015', 'edge_dst': 'FG3C000014', 'edge_src_display_label': 'foreign direct investments', 'edge_dst_display_label': 'energy consumption'}, {'paper_id': 'W4295854499__gpt5mini_low', 'title': 'Natural resource dependence and institutional quality: Evidence from Sub-Saharan Africa', 'year': 2022, 'edge_src': 'FG3C000015', 'edge_dst': 'FG3C000036', 'edge_src_display_label': 'foreign direct investments', 'edge_dst_display_label': 'institutional quality'}]","['China', 'India']","['China', 'India', 'Nigeria']",China and India,"China, India, and related settings","foreign direct investments studies are common in China and India; agricultural output studies are common in China, India, and related settings.",0.1327,https://frontiergraph-app-1058669339361.us-central1.run.app?view=question&pair=FG3C000015__FG3C001309
FG3C000063__FG3C002284,FG3C000063,FG3C002284,green finance,firm total factor productivity (TFP),green finance,firm total factor productivity (TFP),FG3C000063,FG3C002284,False,False,0.0,"['green fiscal policies', 'green insurance', 'green financial policies']","['firm total factor productivity', 'aggregate TFP', 'total factor productivity (TFP) of manufacturing firms']",adjacent,core,True,0.117981,0.213506,0.095525,0.00529,1.0,10,11,0,No direct papers yet,10,green finance and firm total factor productivity (TFP) are already linked by 10 nearby intermediate topics.,Start with a short review or pilot study that follows the nearest mediating topics.,Missing direct link,firm total factor productivity (TFP) and green finance,green-finance-firm-total-factor-productivity,False,"['technological innovation', 'green innovation', 'technological progress']","['technological innovation', 'green innovation', 'technological progress']","['technological innovation', 'green innovation', 'technological progress']","[{'paper_id': 'W4414623232__gpt5mini_low', 'title': 'Exploring the Relationship Between Green Finance and Carbon Productivity: The Mediating Role of Technological Progress Bias', 'year': 2025, 'edge_src': 'FG3C000063', 'edge_dst': 'FG3C000045', 'edge_src_display_label': 'green finance', 'edge_dst_display_label': 'technological progress'}, {'paper_id': 'W4389142932__gpt5mini_low', 'title': 'The impact of green finance on total factor carbon emission reduction efficiency in China', 'year': 2023, 'edge_src': 'FG3C000063', 'edge_dst': 'FG3C000045', 'edge_src_display_label': 'green finance', 'edge_dst_display_label': 'technological progress'}, {'paper_id': 'W7126463937__gpt5mini_low', 'title': 'How Green Finance Drives New Quality Productivity in China’s Energy Sector', 'year': 2026, 'edge_src': 'FG3C000063', 'edge_dst': 'FG3C000013', 'edge_src_display_label': 'green finance', 'edge_dst_display_label': 'technological innovation'}]","['China', 'OECD']","['China', 'United States']",China and OECD,China and United States,green finance studies are common in China and OECD; firm total factor productivity (TFP) studies are common in China and United States.,0.1264,https://frontiergraph-app-1058669339361.us-central1.run.app?view=question&pair=FG3C000063__FG3C002284
FG3C000035__FG3C006124,FG3C006124,FG3C000035,US dollar exchange rate,stock returns,US dollar exchange rate,stock returns,FG3C006124,FG3C000035,False,False,0.0,"['dollar appreciation', 'dollar index', 'dollar']","['past stock returns', 'global stock returns', 'intraday returns']",core,core,False,0.185423,0.207328,0.021905,0.00212,1.0,10,10,0,No direct papers yet,10,US dollar exchange rate and stock returns are already linked by 10 nearby intermediate topics.,A short synthesis or pilot design looks like the sensible first move.,Missing direct link,stock returns and US dollar exchange rate,us-dollar-exchange-rate-stock-returns,False,"['exchange rates', 'inflation', 'gold returns']","['exchange rates', 'inflation', 'gold returns']","['exchange rates', 'inflation', 'gold returns']","[{'paper_id': 'W4401932250__gpt5mini_low', 'title': 'Interplay between oil prices, country risks, and stock returns in the context of global conflict: A PVAR approach', 'year': 2024, 'edge_src': 'FG3C000034', 'edge_dst': 'FG3C000035', 'edge_src_display_label': 'oil prices', 'edge_dst_display_label': 'stock returns'}, {'paper_id': 'W4303579764__gpt5mini_low', 'title': 'Oil prices and sectoral stock returns in the BRICS-T countries: A time-varying approach', 'year': 2022, 'edge_src': 'FG3C000034', 'edge_dst': 'FG3C000035', 'edge_src_display_label': 'oil prices', 'edge_dst_display_label': 'stock returns'}, {'paper_id': 'W2104249109__gpt5mini_low', 'title': 'Stock returns and inflation in Pakistan', 'year': 2015, 'edge_src': 'FG3C000002', 'edge_dst': 'FG3C000035', 'edge_src_display_label': 'inflation', 'edge_dst_display_label': 'stock returns'}]","['United States', 'India']","['China', 'United States']",United States and India,China and United States,US dollar exchange rate studies are common in United States and India; stock returns studies are common in China and United States.,0.1106,https://frontiergraph-app-1058669339361.us-central1.run.app?view=question&pair=FG3C000035__FG3C006124
