pair_key,source_id,target_id,source_label,target_label,source_display_label,target_display_label,source_display_concept_id,target_display_concept_id,source_display_refined,target_display_refined,display_refinement_confidence,source_alternate_display_labels,target_alternate_display_labels,source_bucket,target_bucket,cross_field,score,base_score,duplicate_penalty,path_support_norm,gap_bonus,mediator_count,motif_count,cooc_count,direct_link_status,supporting_path_count,why_now,recommended_move,slice_label,public_pair_label,question_family,suppress_from_public_ranked_window,top_mediator_labels,top_mediator_display_labels,top_mediator_baseline_labels,representative_papers,top_countries_source,top_countries_target,source_context_summary,target_context_summary,common_contexts,public_specificity_score,app_link
FG3C000094__FG3C001436,FG3C000094,FG3C001436,green technology innovation,cost of debt,green technology innovation,cost of debt,FG3C000094,FG3C001436,False,False,0.0,"['urban green technology innovation', 'digital technology innovation', 'green technology adoption']","['cost of debt financing', ""firms' cost of capital"", 'level of debt']",adjacent,core,True,0.122298,0.20204,0.079742,0.000353,1.0,3,3,0,No direct papers yet,3,green technology innovation and cost of debt are already linked by 3 nearby intermediate topics.,Start with a short review or pilot study that follows the nearest mediating topics.,Missing direct link,cost of debt and green technology innovation,green-technology-innovation-cost-of-debt,False,"['carbon intensity', 'ESG ratings', 'cost of equity capital']","['carbon intensity', 'ESG ratings', 'cost of equity capital']","['carbon intensity', 'ESG ratings', 'cost of equity capital']","[{'paper_id': 'W4291123213__gpt5mini_low', 'title': 'Does green technology innovation matter to the cost of equity capital?', 'year': 2022, 'edge_src': 'FG3C000094', 'edge_dst': 'FG3C001394', 'edge_src_display_label': 'green technology innovation', 'edge_dst_display_label': 'cost of equity capital'}, {'paper_id': 'W7117993861__gpt5mini_low', 'title': 'Green finance and carbon intensity in OECD economies–Mediating roles of industrial structure upgrading and green technology innovation', 'year': 2026, 'edge_src': 'FG3C000094', 'edge_dst': 'FG3C000184', 'edge_src_display_label': 'green technology innovation', 'edge_dst_display_label': 'carbon intensity'}, {'paper_id': 'W4408514463__gpt5mini_low', 'title': 'Green technology innovation, ESG ratings and corporate sustainable performance: Empirical evidence from listed semiconductor companies in China', 'year': 2025, 'edge_src': 'FG3C000094', 'edge_dst': 'FG3C003317', 'edge_src_display_label': 'green technology innovation', 'edge_dst_display_label': 'ESG ratings'}]","['China', 'India']","['China', 'United States', 'Europe']",China and India,"China, United States, and related settings","green technology innovation studies are common in China and India; cost of debt studies are common in China, United States, and related settings.",-1.5982,https://frontiergraph-app-1058669339361.us-central1.run.app?view=question&pair=FG3C000094__FG3C001436
FG3C000215__FG3C000800,FG3C000800,FG3C000215,learning by doing,green total factor productivity (GTFP),learning by doing,green total factor productivity (GTFP),FG3C000800,FG3C000215,False,False,0.0,"['Employer learning', 'on-the-job learning', 'development process']","['agricultural green total factor productivity (AGTFP)', 'enterprise green total factor productivity (GTFP)', 'industrial green total factor productivity (GTFP)']",core,adjacent,True,0.120907,0.201783,0.080876,0.000352,1.0,3,3,0,No direct papers yet,3,learning by doing and green total factor productivity (GTFP) are already linked by 3 nearby intermediate topics.,Start with a short review or pilot study that follows the nearest mediating topics.,Missing direct link,learning by doing and green total factor productivity (GTFP),learning-by-doing-green-total-factor-productivity,False,"['foreign direct investments', 'technical change', 'technical progress']","['foreign direct investments', 'technical change', 'technical progress']","['foreign direct investments', 'technical change', 'technical progress']","[{'paper_id': 'W4400249376__gpt5mini_low', 'title': 'Environmental Regulation, Foreign Direct Investment, and Green Total Factor Productivity: An Empirical Test Based on Chinese City-Level Panel Data', 'year': 2024, 'edge_src': 'FG3C000015', 'edge_dst': 'FG3C000215', 'edge_src_display_label': 'foreign direct investments', 'edge_dst_display_label': 'green total factor productivity (GTFP)'}, {'paper_id': 'W4402781390__gpt5mini_low', 'title': 'Impact of Foreign Direct Investment on Green Total Factor Productivity: New Evidence from Yangtze River Delta in China', 'year': 2024, 'edge_src': 'FG3C000015', 'edge_dst': 'FG3C000215', 'edge_src_display_label': 'foreign direct investments', 'edge_dst_display_label': 'green total factor productivity (GTFP)'}, {'paper_id': 'W4288449823__gpt5mini_low', 'title': 'Spatial Differences and Influencing Factors of Industrial Green Total Factor Productivity in Chinese Industries', 'year': 2022, 'edge_src': 'FG3C000015', 'edge_dst': 'FG3C000215', 'edge_src_display_label': 'foreign direct investments', 'edge_dst_display_label': 'green total factor productivity (GTFP)'}]","['Italy', 'China', 'France']","['China', 'OECD']","Italy, China, and related settings",China and OECD,"learning by doing studies are common in Italy, China, and related settings; green total factor productivity (GTFP) studies are common in China and OECD.",-1.5982,https://frontiergraph-app-1058669339361.us-central1.run.app?view=question&pair=FG3C000215__FG3C000800
FG3C001450__FG3C003177,FG3C001450,FG3C003177,comparative effectiveness research (CER),urban green total factor productivity (GTFP),comparative effectiveness research (CER),urban green total factor productivity (GTFP),FG3C001450,FG3C003177,False,False,0.0,"['Patient-Centered Outcomes Research Institute (PCORI)', 'Agency for Health Care Policy and Research (AHCPR)', 'cost-effectiveness ratio']","['industrial green total factor productivity', 'regional green total factor productivity (GTFP)', 'Provincial green total factor productivity (GTFP)']",adjacent,adjacent,False,0.117138,0.201839,0.084701,0.000313,1.0,3,3,0,No direct papers yet,3,comparative effectiveness research (CER) and urban green total factor productivity (GTFP) are already linked by 3 nearby intermediate topics.,A short synthesis or pilot design looks like the sensible first move.,Missing direct link,comparative effectiveness research (CER) and urban green total factor productivity (GTFP),comparative-effectiveness-research-urban-green-total-factor-productivity,False,"['foreign direct investments', 'industrial structure upgrading', 'R&D investment']","['foreign direct investments', 'industrial structure upgrading', 'R&D investment']","['foreign direct investments', 'industrial structure upgrading', 'R&D investment']","[{'paper_id': 'W4210418131__gpt5mini_low', 'title': 'The impact assessment of smart city policy on urban green total-factor productivity: Evidence from China', 'year': 2022, 'edge_src': 'FG3C000097', 'edge_dst': 'FG3C003177', 'edge_src_display_label': 'industrial structure upgrading', 'edge_dst_display_label': 'urban green total factor productivity (GTFP)'}, {'paper_id': 'W4214587818__gpt5mini_low', 'title': 'Can FDI facilitate green total factor productivity in China? Evidence from regional diversity', 'year': 2022, 'edge_src': 'FG3C000015', 'edge_dst': 'FG3C003177', 'edge_src_display_label': 'foreign direct investments', 'edge_dst_display_label': 'urban green total factor productivity (GTFP)'}, {'paper_id': 'W2916313820__gpt5mini_low', 'title': ""Has China's Belt and Road Initiative promoted its green total factor productivity？——Evidence from primary provinces along the route"", 'year': 2019, 'edge_src': 'FG3C000089', 'edge_dst': 'FG3C003177', 'edge_src_display_label': 'R&D investment', 'edge_dst_display_label': 'urban green total factor productivity (GTFP)'}]","['United States', 'China']",['China'],United States and China,China,comparative effectiveness research (CER) studies are common in United States and China; urban green total factor productivity (GTFP) studies are common in China.,-1.5984,https://frontiergraph-app-1058669339361.us-central1.run.app?view=question&pair=FG3C001450__FG3C003177
FG3C004596__FG3C006124,FG3C004596,FG3C006124,Non-fungible tokens (NFTs),US dollar exchange rate,Non-fungible tokens (NFTs),US dollar exchange rate,FG3C004596,FG3C006124,False,False,0.0,"['non-parametric tests', 'stablecoins', 'COVID-19 cases and deaths']","['dollar appreciation', 'dollar index', 'dollar']",core,core,False,0.183821,0.201836,0.018014,0.000282,1.0,3,3,0,No direct papers yet,3,Non-fungible tokens (NFTs) and US dollar exchange rate are already linked by 3 nearby intermediate topics.,A short synthesis or pilot design looks like the sensible first move.,Missing direct link,Non-fungible tokens (NFTs) and US dollar exchange rate,non-fungible-tokens-us-dollar-exchange-rate,False,"['Bitcoin', 'gold', 'oil']","['Bitcoin', 'gold', 'oil']","['Bitcoin', 'gold', 'oil']","[{'paper_id': 'W4294204425__gpt5mini_low', 'title': 'The hedge and safe haven properties of non-fungible tokens (NFTs): Evidence from the nonlinear autoregressive distributed lag (NARDL) model', 'year': 2022, 'edge_src': 'FG3C004596', 'edge_dst': 'FG3C000101', 'edge_src_display_label': 'Non-fungible tokens (NFTs)', 'edge_dst_display_label': 'gold'}, {'paper_id': 'W2916989671__gpt5mini_low', 'title': 'RETRACTED: On the conditional dependence structure between oil, gold and USD exchange rates: Nested copula based GJR-GARCH model', 'year': 2019, 'edge_src': 'FG3C000101', 'edge_dst': 'FG3C006124', 'edge_src_display_label': 'gold', 'edge_dst_display_label': 'US dollar exchange rate'}, {'paper_id': 'W2145501956__gpt5mini_low', 'title': 'Bitcoin, gold and the dollar – A GARCH volatility analysis', 'year': 2016, 'edge_src': 'FG3C000209', 'edge_dst': 'FG3C006124', 'edge_src_display_label': 'Bitcoin', 'edge_dst_display_label': 'US dollar exchange rate'}]","['United States', 'Canada', 'Indonesia']","['United States', 'India']","United States, Canada, and related settings",United States and India,"Non-fungible tokens (NFTs) studies are common in United States, Canada, and related settings; US dollar exchange rate studies are common in United States and India.",-1.5986,https://frontiergraph-app-1058669339361.us-central1.run.app?view=question&pair=FG3C004596__FG3C006124
FG3C000215__FG3C000310,FG3C000310,FG3C000215,quality of life,green total factor productivity (GTFP),quality of life,green total factor productivity (GTFP),FG3C000310,FG3C000215,False,False,0.0,['urbanization quality'],"['agricultural green total factor productivity (AGTFP)', 'enterprise green total factor productivity (GTFP)', 'industrial green total factor productivity (GTFP)']",adjacent,adjacent,False,0.117714,0.201821,0.084107,0.000257,1.0,3,3,0,No direct papers yet,3,quality of life and green total factor productivity (GTFP) are already linked by 3 nearby intermediate topics.,A short synthesis or pilot design looks like the sensible first move.,Missing direct link,green total factor productivity (GTFP) and quality of life,quality-of-life-green-total-factor-productivity,False,"['urbanization', 'trade openness', 'research and development (R&D)']","['urbanization', 'trade openness', 'research and development (R&D)']","['urbanization', 'trade openness', 'research and development (R&D)']","[{'paper_id': 'W4380052490__gpt5mini_low', 'title': 'Non-Linear Impacts and Spatial Spillover of Digital Finance on Green Total Factor Productivity: An Empirical Study of Smart Cities in China', 'year': 2023, 'edge_src': 'FG3C000012', 'edge_dst': 'FG3C000215', 'edge_src_display_label': 'urbanization', 'edge_dst_display_label': 'green total factor productivity (GTFP)'}, {'paper_id': 'W4312070889__gpt5mini_low', 'title': 'Analysis of Regional Social Capital, Enterprise Green Innovation and Green Total Factor Productivity—Based on Chinese A-Share Listed Companies from 2011 to 2019', 'year': 2022, 'edge_src': 'FG3C000012', 'edge_dst': 'FG3C000215', 'edge_src_display_label': 'urbanization', 'edge_dst_display_label': 'green total factor productivity (GTFP)'}, {'paper_id': 'W4297103463__gpt5mini_low', 'title': 'Does green innovation induce green total factor productivity? Novel findings from Chinese city level data', 'year': 2022, 'edge_src': 'FG3C000012', 'edge_dst': 'FG3C000215', 'edge_src_display_label': 'urbanization', 'edge_dst_display_label': 'green total factor productivity (GTFP)'}]","['China', 'Australia', 'Pakistan']","['China', 'OECD']","China, Australia, and related settings",China and OECD,"quality of life studies are common in China, Australia, and related settings; green total factor productivity (GTFP) studies are common in China and OECD.",-1.5987,https://frontiergraph-app-1058669339361.us-central1.run.app?view=question&pair=FG3C000215__FG3C000310
FG3C000071__FG3C001821,FG3C001821,FG3C000071,enterprise digital transformation,economic policy uncertainty,enterprise digital transformation,economic policy uncertainty,FG3C001821,FG3C000071,False,False,0.0,['enterprise development'],"['economic policy uncertainty index', 'economic policy uncertainty (EPU)', 'US policy uncertainty']",adjacent,core,True,0.111998,0.201761,0.089763,0.000255,1.0,3,3,0,No direct papers yet,3,enterprise digital transformation and economic policy uncertainty are already linked by 3 nearby intermediate topics.,Start with a short review or pilot study that follows the nearest mediating topics.,Missing direct link,economic policy uncertainty and enterprise digital transformation,enterprise-digital-transformation-economic-policy-uncertainty,False,"['internal control', 'government subsidies', 'financing constraints']","['internal control', 'government subsidies', 'financing constraints']","['internal control', 'government subsidies', 'financing constraints']","[{'paper_id': 'W4382136789__gpt5mini_low', 'title': 'The Effect of Enterprise Digital Transformation on Green Technology Innovation: A Quantitative Study on Chinese Listed Companies', 'year': 2023, 'edge_src': 'FG3C001821', 'edge_dst': 'FG3C000164', 'edge_src_display_label': 'enterprise digital transformation', 'edge_dst_display_label': 'government subsidies'}, {'paper_id': 'W4390350090__gpt5mini_low', 'title': 'Can enterprise digital transformation reduce the reliance on bank credit? Evidence from China', 'year': 2023, 'edge_src': 'FG3C001821', 'edge_dst': 'FG3C000090', 'edge_src_display_label': 'enterprise digital transformation', 'edge_dst_display_label': 'financing constraints'}, {'paper_id': 'W4405837780__gpt5mini_low', 'title': 'A study on the impact of enterprise digital transformation on informed trading', 'year': 2024, 'edge_src': 'FG3C001821', 'edge_dst': 'FG3C003191', 'edge_src_display_label': 'enterprise digital transformation', 'edge_dst_display_label': 'internal control'}]","['China', 'sub-Saharan Africa']","['China', 'United States']",China and sub-Saharan Africa,China and United States,enterprise digital transformation studies are common in China and sub-Saharan Africa; economic policy uncertainty studies are common in China and United States.,-1.5987,https://frontiergraph-app-1058669339361.us-central1.run.app?view=question&pair=FG3C000071__FG3C001821
FG3C000681__FG3C004508,FG3C004508,FG3C000681,labour market reforms,foreign direct investment (FDI) inflow,labour market reforms,foreign direct investment (FDI) inflow,FG3C004508,FG3C000681,False,False,0.0,"['product market reforms', 'labor market deregulation', 'labor market regulation']","['horizontal FDI', 'inward FDI']",core,adjacent,True,0.113226,0.20181,0.088584,0.000233,1.0,3,3,0,No direct papers yet,3,labour market reforms and foreign direct investment (FDI) inflow are already linked by 3 nearby intermediate topics.,Start with a short review or pilot study that follows the nearest mediating topics.,Missing direct link,labour market reforms and foreign direct investment (FDI) inflow,labour-market-reforms-foreign-direct-investment-inflow,False,"['unemployment', 'investment', 'innovation']","['unemployment', 'investment', 'innovation']","['unemployment', 'investment', 'innovation']","[{'paper_id': 'W4391255947__gpt5mini_low', 'title': 'Nexus of innovation, foreign direct investment, economic growth and renewable energy: New insights from 60 countries', 'year': 2024, 'edge_src': 'FG3C000030', 'edge_dst': 'FG3C000681', 'edge_src_display_label': 'innovation', 'edge_dst_display_label': 'foreign direct investment (FDI) inflow'}, {'paper_id': 'W1991771386__gpt5mini_low', 'title': 'Banking crises, labour reforms, and unemployment: a comment', 'year': 2015, 'edge_src': 'FG3C004508', 'edge_dst': 'FG3C000009', 'edge_src_display_label': 'labour market reforms', 'edge_dst_display_label': 'unemployment'}, {'paper_id': 'W1131905619__gpt5mini_low', 'title': 'Does investment in capacity encourage FDI?', 'year': 2015, 'edge_src': 'FG3C000019', 'edge_dst': 'FG3C000681', 'edge_src_display_label': 'investment', 'edge_dst_display_label': 'foreign direct investment (FDI) inflow'}]","['25 OECD countries', 'Chile', '22 European countries']","['China', 'India', 'BRICS']","25 OECD countries, Chile, and related settings","China, India, and related settings","labour market reforms studies are common in 25 OECD countries, Chile, and related settings; foreign direct investment (FDI) inflow studies are common in China, India, and related settings.",-1.5988,https://frontiergraph-app-1058669339361.us-central1.run.app?view=question&pair=FG3C000681__FG3C004508
FG3C000061__FG3C003353,FG3C003353,FG3C000061,digital inclusive finance (DIF),total factor productivity (TFP),digital inclusive finance (DIF),total factor productivity (TFP),FG3C003353,FG3C000061,False,False,0.0,[],['productivity (TFP)'],adjacent,core,True,0.113021,0.201974,0.088953,0.00023,1.0,3,4,0,No direct papers yet,3,digital inclusive finance (DIF) and total factor productivity (TFP) are already linked by 3 nearby intermediate topics.,Start with a short review or pilot study that follows the nearest mediating topics.,Missing direct link,total factor productivity (TFP) and digital inclusive finance (DIF),digital-inclusive-finance-total-factor-productivity,False,"['technological innovation', 'information and communication technology (ICT)', 'green technology innovation']","['technological innovation', 'information and communication technology (ICT)', 'green technology innovation']","['technological innovation', 'information and communication technology (ICT)', 'green technology innovation']","[{'paper_id': 'W4384701397__gpt5mini_low', 'title': 'Digital inclusive finance and green total factor productivity growth in rural areas', 'year': 2023, 'edge_src': 'FG3C003353', 'edge_dst': 'FG3C000094', 'edge_src_display_label': 'digital inclusive finance (DIF)', 'edge_dst_display_label': 'green technology innovation'}, {'paper_id': 'W4391594645__gpt5mini_low', 'title': 'Unveiling the affecting mechanism of digital transformation on total factor productivity of Chinese firms', 'year': 2024, 'edge_src': 'FG3C000384', 'edge_dst': 'FG3C000061', 'edge_src_display_label': 'information and communication technology (ICT)', 'edge_dst_display_label': 'total factor productivity (TFP)'}, {'paper_id': 'W4408335706__gpt5mini_low', 'title': 'Can the Development of Digital Inclusive Finance Curb Carbon Emissions?: A Spatial Panel Analysis for China Under the PVAR Approach', 'year': 2025, 'edge_src': 'FG3C003353', 'edge_dst': 'FG3C000013', 'edge_src_display_label': 'digital inclusive finance (DIF)', 'edge_dst_display_label': 'technological innovation'}]","['China', 'Taiwan']","['China', 'Italy', 'United States']",China and Taiwan,"China, Italy, and related settings","digital inclusive finance (DIF) studies are common in China and Taiwan; total factor productivity (TFP) studies are common in China, Italy, and related settings.",-1.5988,https://frontiergraph-app-1058669339361.us-central1.run.app?view=question&pair=FG3C000061__FG3C003353
FG3C000247__FG3C005161,FG3C005161,FG3C000247,state of the business cycle,cost of capital,state of the business cycle,cost of capital,FG3C005161,FG3C000247,False,False,0.0,"['Business cycle conditions', 'business cycle phase', 'business sector']","['capital budgeting', ""firms' cost of capital"", 'external financing costs']",core,core,False,0.172036,0.201803,0.029767,0.000199,1.0,3,3,0,No direct papers yet,3,state of the business cycle and cost of capital are already linked by 3 nearby intermediate topics.,A short synthesis or pilot design looks like the sensible first move.,Missing direct link,cost of capital and state of the business cycle,state-of-the-business-cycle-cost-of-capital,False,"['cross-sectional stock returns', 'investment', 'uncertainty measures']","['cross-sectional stock returns', 'investment', 'uncertainty measures']","['cross-sectional stock returns', 'investment', 'uncertainty measures']","[{'paper_id': 'W1971235474__gpt5mini_low', 'title': 'Investment, Market Structure, and the Cost of Capital', 'year': 1979, 'edge_src': 'FG3C000019', 'edge_dst': 'FG3C000247', 'edge_src_display_label': 'investment', 'edge_dst_display_label': 'cost of capital'}, {'paper_id': 'W4234322793__gpt5mini_low', 'title': 'Investment, Market Structure, and the Cost of Capital', 'year': 1979, 'edge_src': 'FG3C000019', 'edge_dst': 'FG3C000247', 'edge_src_display_label': 'investment', 'edge_dst_display_label': 'cost of capital'}, {'paper_id': 'W3125878125__gpt5mini_low', 'title': 'Cost of capital effects and changes in growth expectations around U.S. cross-listings', 'year': 2009, 'edge_src': 'FG3C002163', 'edge_dst': 'FG3C000247', 'edge_src_display_label': 'cross-sectional stock returns', 'edge_dst_display_label': 'cost of capital'}]","['China', 'United States']","['China', 'United States', 'Japan']",China and United States,"China, United States, and related settings","state of the business cycle studies are common in China and United States; cost of capital studies are common in China, United States, and related settings.",-1.599,https://frontiergraph-app-1058669339361.us-central1.run.app?view=question&pair=FG3C000247__FG3C005161
FG3C000118__FG3C000478,FG3C000478,FG3C000118,gross domestic product,industrialization,gross domestic product,industrialization,FG3C000478,FG3C000118,False,False,0.0,[],"['de-industrialization', 'industrialization process']",adjacent,adjacent,False,0.185462,0.207732,0.022269,0.003454,1.0,7,5,0,No direct papers yet,7,gross domestic product and industrialization are already linked by 7 nearby intermediate topics.,A short synthesis or pilot design looks like the sensible first move.,Missing direct link,gross domestic product and industrialization,gross-domestic-product-industrialization,False,"['CO2 emissions', 'ecological footprint', 'financial development']","['CO2 emissions', 'ecological footprint', 'financial development']","['CO2 emissions', 'ecological footprint', 'financial development']","[{'paper_id': 'W4382656908__gpt5mini_low', 'title': 'What drives resource sustainability in Asia? Discovering the moderating role of financial development and industrialization', 'year': 2023, 'edge_src': 'FG3C000006', 'edge_dst': 'FG3C000118', 'edge_src_display_label': 'financial development', 'edge_dst_display_label': 'industrialization'}, {'paper_id': 'W2102490841__gpt5mini_low', 'title': 'Does financial development increase energy consumption? The role of industrialization and urbanization in Tunisia', 'year': 2011, 'edge_src': 'FG3C000006', 'edge_dst': 'FG3C000118', 'edge_src_display_label': 'financial development', 'edge_dst_display_label': 'industrialization'}, {'paper_id': 'W4399202360__gpt5mini_low', 'title': 'Time-varying causality relationships between trade openness, technological innovation, industrialization, financial development, and carbon emissions in Thailand', 'year': 2024, 'edge_src': 'FG3C000003', 'edge_dst': 'FG3C000118', 'edge_src_display_label': 'CO2 emissions', 'edge_dst_display_label': 'industrialization'}]","['China', 'India', 'United States']","['China', 'Pakistan']","China, India, and related settings",China and Pakistan,"gross domestic product studies are common in China, India, and related settings; industrialization studies are common in China and Pakistan.",-1.6827,https://frontiergraph-app-1058669339361.us-central1.run.app?view=question&pair=FG3C000118__FG3C000478
